{
  "session_id": "demo-session-001",
  "company_name": "Acme SaaS Corp",
  "analyst_name": "FDE Demo",
  "industry": "B2B SaaS",
  "avg_deal_cycle_days": 45,
  "deals": [
    {
      "deal_id": "DEAL-001",
      "company": "TechNova Solutions",
      "arr_value": 48000,
      "stage": "closedlost",
      "close_date": "2025-12-15",
      "days_in_cycle": 62,
      "ae_name": "Sarah Chen",
      "ae_stated_reason": "Price too high",
      "competitor": "CompetitorX",
      "deal_size_bucket": "mid_market",
      "product_evaluated": "Enterprise Plan",
      "discount_offered": 15,
      "contacts": [
        {"name": "James Park", "title": "VP Engineering", "role": "technical_buyer", "engagement_level": "high"},
        {"name": "Lisa Wong", "title": "Director of DevOps", "role": "champion", "engagement_level": "high"}
      ],
      "call_transcripts": [
        {
          "date": "2025-10-20",
          "duration_minutes": 45,
          "attendees": ["Sarah Chen", "James Park", "Lisa Wong"],
          "summary": "Discovery call. James and Lisa are excited about the platform. They have 12 engineering teams and need better observability. Lisa mentioned they're evaluating CompetitorX as well. Budget discussion was deferred - Lisa said 'let's focus on the technical fit first.' No CFO or VP Finance mentioned.",
          "call_type": "discovery"
        },
        {
          "date": "2025-11-05",
          "duration_minutes": 60,
          "attendees": ["Sarah Chen", "James Park", "Lisa Wong", "3 engineers"],
          "summary": "Technical demo. Team loved the real-time analytics dashboard. Engineers asked about API rate limits and custom integrations. Lisa asked if we could do a POC. James said 'this looks great but I need to check with Mark (CFO) on budget timing.' Sarah did not follow up on the CFO introduction.",
          "call_type": "demo"
        },
        {
          "date": "2025-12-01",
          "duration_minutes": 30,
          "attendees": ["Sarah Chen", "Lisa Wong"],
          "summary": "Lisa called to say they're going with CompetitorX. 'Your product is better but their price point was significantly lower and Mark felt we couldn't justify the premium without a clear ROI case.' Sarah offered a 15% discount but Lisa said 'it's too late, the decision has been made at the exec level.'",
          "call_type": "negotiation"
        }
      ],
      "email_threads": [
        {
          "subject": "Follow-up: TechNova + Acme Partnership",
          "date_range": "2025-10-21 to 2025-12-10",
          "summary": "16 emails exchanged. All with Lisa and James. No executive stakeholders ever included. Sarah sent a pricing proposal on Nov 15 but it was a standard template with no ROI analysis or business case.",
          "participants": ["Sarah Chen", "James Park", "Lisa Wong"]
        }
      ],
      "notes": "Sarah's CRM note: 'Lost on price. CompetitorX was 40% cheaper. Need to revisit pricing strategy.'"
    },
    {
      "deal_id": "DEAL-002",
      "company": "DataStream Analytics",
      "arr_value": 72000,
      "stage": "closedlost",
      "close_date": "2025-11-30",
      "days_in_cycle": 95,
      "ae_name": "Mike Johnson",
      "ae_stated_reason": "No budget this quarter",
      "competitor": "",
      "deal_size_bucket": "mid_market",
      "product_evaluated": "Enterprise Plan",
      "discount_offered": 0,
      "contacts": [
        {"name": "Rachel Kim", "title": "Head of Data Engineering", "role": "champion", "engagement_level": "medium"}
      ],
      "call_transcripts": [
        {
          "date": "2025-09-01",
          "duration_minutes": 30,
          "attendees": ["Mike Johnson", "Rachel Kim"],
          "summary": "Discovery call. Rachel is excited about the data pipeline features. She mentioned her team spends 20+ hours/week on manual data reconciliation. No discussion of budget, timeline, or decision process. Mike did not ask about other stakeholders.",
          "call_type": "discovery"
        },
        {
          "date": "2025-09-20",
          "duration_minutes": 45,
          "attendees": ["Mike Johnson", "Rachel Kim"],
          "summary": "Demo focused on technical capabilities. Rachel said 'this would save us so much time.' Mike asked her to 'champion this internally.' No mutual action plan or next steps defined beyond 'I'll talk to my boss.'",
          "call_type": "demo"
        },
        {
          "date": "2025-11-15",
          "duration_minutes": 15,
          "attendees": ["Mike Johnson", "Rachel Kim"],
          "summary": "Rachel apologized and said the initiative was deprioritized. 'My VP said we don't have budget this quarter and we need to focus on the migration project.' Mike said he'd check back in Q2.",
          "call_type": "follow_up"
        }
      ],
      "email_threads": [
        {
          "subject": "DataStream + Acme: Next Steps?",
          "date_range": "2025-09-25 to 2025-11-15",
          "summary": "8 emails. Mike followed up 4 times asking 'any update on internal alignment?' Rachel responded with delays each time. No escalation attempted. No additional stakeholders engaged.",
          "participants": ["Mike Johnson", "Rachel Kim"]
        }
      ],
      "notes": "Mike's CRM note: 'Budget pushed to Q2 2026. Will follow up in April.' 95-day cycle with only 3 calls and 1 contact engaged."
    },
    {
      "deal_id": "DEAL-003",
      "company": "CloudFirst Inc",
      "arr_value": 120000,
      "stage": "closedlost",
      "close_date": "2026-01-10",
      "days_in_cycle": 38,
      "ae_name": "Sarah Chen",
      "ae_stated_reason": "Went with incumbent vendor",
      "competitor": "LegacyCorp",
      "deal_size_bucket": "enterprise",
      "product_evaluated": "Enterprise Plan",
      "discount_offered": 20,
      "contacts": [
        {"name": "Tom Martinez", "title": "CTO", "role": "economic_buyer", "engagement_level": "low"},
        {"name": "Priya Patel", "title": "VP Engineering", "role": "technical_buyer", "engagement_level": "high"},
        {"name": "David Lee", "title": "Senior Architect", "role": "influencer", "engagement_level": "high"}
      ],
      "call_transcripts": [
        {
          "date": "2025-12-05",
          "duration_minutes": 60,
          "attendees": ["Sarah Chen", "Priya Patel", "David Lee"],
          "summary": "Strong discovery. Priya and David detailed pain points with LegacyCorp: slow support, outdated UI, missing real-time features. David said 'we need real-time event processing - LegacyCorp can't do this.' Priya mentioned Tom (CTO) would need to approve but 'he trusts our recommendation.'",
          "call_type": "discovery"
        },
        {
          "date": "2025-12-18",
          "duration_minutes": 90,
          "attendees": ["Sarah Chen", "Priya Patel", "David Lee", "4 engineers"],
          "summary": "Full technical deep dive. Team was impressed. David asked about real-time event processing capability. Sarah said 'it's on our roadmap for Q2.' David's face fell - 'that's actually our #1 requirement. We assumed you had this already based on your marketing.' Priya said they'd discuss internally.",
          "call_type": "technical_review"
        },
        {
          "date": "2026-01-08",
          "duration_minutes": 20,
          "attendees": ["Sarah Chen", "Priya Patel"],
          "summary": "Priya informed Sarah they're staying with LegacyCorp. 'Tom said without real-time event processing, the migration risk isn't justified. LegacyCorp promised to deliver an updated UI in Q2.' Sarah offered 20% discount. Priya said 'it's not about price, it's about the feature gap.'",
          "call_type": "follow_up"
        }
      ],
      "email_threads": [
        {
          "subject": "CloudFirst Technical Evaluation: Acme Platform",
          "date_range": "2025-12-06 to 2026-01-10",
          "summary": "22 emails. Deep technical discussions with David and Priya. Tom (CTO) was CC'd on 2 emails but never responded. Sarah never had a direct conversation with Tom.",
          "participants": ["Sarah Chen", "Priya Patel", "David Lee", "Tom Martinez (CC only)"]
        }
      ],
      "notes": "Highest value deal lost this quarter. Real-time event processing is a critical gap."
    },
    {
      "deal_id": "DEAL-004",
      "company": "ScaleUp Partners",
      "arr_value": 36000,
      "stage": "closedlost",
      "close_date": "2025-12-20",
      "days_in_cycle": 110,
      "ae_name": "Mike Johnson",
      "ae_stated_reason": "Prospect went dark",
      "competitor": "",
      "deal_size_bucket": "smb",
      "product_evaluated": "Growth Plan",
      "discount_offered": 0,
      "contacts": [
        {"name": "Amy Rodriguez", "title": "Head of Operations", "role": "champion", "engagement_level": "low"}
      ],
      "call_transcripts": [
        {
          "date": "2025-09-05",
          "duration_minutes": 30,
          "attendees": ["Mike Johnson", "Amy Rodriguez"],
          "summary": "Inbound lead. Amy saw a webinar and was interested. She manages a team of 15 and needs workflow automation. Quick discovery but Mike didn't ask about decision process, budget, or timeline. Amy said 'this looks interesting, send me pricing.'",
          "call_type": "discovery"
        },
        {
          "date": "2025-09-25",
          "duration_minutes": 40,
          "attendees": ["Mike Johnson", "Amy Rodriguez"],
          "summary": "Demo. Amy liked what she saw but seemed hesitant. 'I need to figure out if this is something we can prioritize right now.' No mutual action plan set. Mike said 'take your time and let me know.'",
          "call_type": "demo"
        }
      ],
      "email_threads": [
        {
          "subject": "Acme for ScaleUp - Ready When You Are!",
          "date_range": "2025-09-26 to 2025-12-15",